{
  "octetsJeton": 32,
  "expirationJetonMs": 86400000,
  "fenetreValiditeMs": 3600000,
  "prefixeFichier": "zurvela-verification-",
  "octetsScanId": 32,
  "tailleCorpsMax": 8192,
  "port": 8787,
  "verificationGet": {
    "delaiMs": 10000,
    "maxOctets": 65536
  },
  "proxy": {
    "delaiMs": 15000
  },
  "scan": {
    "timeoutMs": 300000
  },
  "quota": {
    "global": 50,
    "parOrigine": 3,
    "depenseMaxUsd": 5,
    "parDestinataire": 3
  },
  "courriel": {
    "expediteur": "rapport@zurvela.com",
    "replyTo": "contact@zurvela.com",
    "delaiMs": 15000,
    "pied": {
      "raisonSociale": "[À COMPLÉTER : ex. Zurvela SASU]",
      "adresse": "[À COMPLÉTER : siège social]",
      "lienMentions": "https://zurvela.com/mentions-legales/",
      "lienConfidentialite": "https://zurvela.com/confidentialite/"
    }
  }
}
